True Sentiment,Tweet ID,Tweet
neutral,1.23458303411388E+018,"flashing to one of 30 possible scenarios, an out of control corona virus pandemic during a Joe Biden presidency, and levitating"
neutral,1.22249160978015E+018,"@Andrew_Adonis There’s a clear majority for Remain, and the number that voted for leave supporting parties in the l… https://t.co/os7UHe8tf8"
negative,1.23651250611968E+018,"My speaking tour in Rome, Perugia, Spain and Hongkong stands cancelled due to the Corona virus concerns. The US tou… https://t.co/Z19xO7FdQE"
positive,1.22263804586781E+018,"I've been watching the news and you know what?  I'm sick of McConnell's B.S.  If you are too, join the team to brin… https://t.co/TgEhghVCe1"
neutral,1.22345466715959E+018,Not Available
neutral,1.23630685160149E+018,Not Available
negative,1.23720528614808E+018,"AP: ""All of Trump's properties, at home and abroad, would stand to suffer if travel and tourism business continues… https://t.co/S1ctTGyOmY"
positive,1.22227817574648E+018,"Mitch McConnell does not represent Kentucky. You know it, I know it, he knows it.  Our first fundraising deadline o… https://t.co/z1oCpIAjmY"
negative,1.22327502896966E+018,Scientists say figuring out the connection between climate change and the spread of disease is the only way to deve… https://t.co/Y9Yg28Re4i
neutral,1.23597049055409E+018,"NEW - from @alexismadrigal and me  After gathering data from all 50 states, and surveying dozens of local officials… https://t.co/pTByfzRQLv"
positive,1.23792120780841E+018,"ESPN just interviewed Mark Cuban who, unprovoked, said that he'll work to get a program going for the team/arena's… https://t.co/5JbED2foAG"
neutral,1.23613625167105E+018,coronavirus made flights so cheap y’all can finally afford to hang out with your internet boyfriend
negative,1.23646429859308E+018,Pres. Trump:  This is your #DailyLie. It's simply not true that your admin has helped make tests available to every… https://t.co/c2wGWuZPVr
negative,1.22223125104793E+018,"Trump is using/abusing the impeachment trial to attack Biden, Muller, the FBI, Comey, Lisa Page, Nellie Orr, and on… https://t.co/FOjT1Jquhz"
positive,1.23627868419102E+018,Time for some more Top Brexiter Insults! They really are comic geniuses...  1) I hope coronavirus wipes out your ki… https://t.co/LezjBXXXHL
negative,1.22263119277797E+018,"Sajid Javid before election: ""No department will be cut next year. Every single department has had its budget for d… https://t.co/1Ti8NLnS1i"
neutral,1.22357787506593E+018,Not Available
neutral,1.237486129169E+018,Aye yo .@JoeBiden.....   You come try to take my guns...  I’ll fuck ya old ass up bro. 😂😂😂   #RumbleMeDickhead
negative,1.22229116842096E+018,New: McConnell Says GOP Doesn’t Have Votes to Block Impeachment Witnesses  Senate majority leader makes remarks in… https://t.co/fxNVyJQ05p
neutral,1.23455478148777E+018,"I understand why nominating Bernie feels risky to people, I would simply like the idea that nominating Biden is als… https://t.co/bJo9z1Nwyr"
negative,1.2236854590685E+018,If America knew Trump traded the continuation of his licensing deal at Trump Towers Istanbul for a retreat of U.S.… https://t.co/LkpyIOMOum
neutral,1.23739910535956E+018,Congress' swift action to pass $8.3 billion emergency legislation was critical to our nation's response to… https://t.co/QVZzJ0Or4z
positive,1.23746976871573E+018,"Devastated. Coronavirus has led to the Greek Government closing all venues that hold 1000+ people. As a result,… https://t.co/NFOLY5O0nO"
neutral,1.236423056245E+018,Extraordinary times. Italy's draft emergency Coronavirus law to ban entry and exit to whole of Lombardy region - ca… https://t.co/Wk6kwADLrV
neutral,1.23203929230796E+018,Not Available
negative,1.22257211625779E+018,The White House has issued a formal threat to Trump's former national security adviser to keep him from publishing… https://t.co/26QzQPau6n
positive,1.23416506406568E+018,"#VERIFIED  👉Just took a round of almost every area- uttam nagar, Khyala, Rajouri, Nawada, Raghubir Nagar, Tilak nag… https://t.co/zHjyTQdvWp"
negative,1.23647208315831E+018,"#LIVE: The Grand Princess cruise ship is still unable to dock, as 21 people on board tested positive for… https://t.co/qsKb8TE7sX"
positive,1.23605451086435E+018,"It's coronavirus out there, they said.😷 Use fists only to touch anything, they said.👊🏻✊🏻 #coronavirus #bach… https://t.co/gnna5UFerf"
negative,1.23651751413538E+018,"As coronavirus dominates the headlines, Asian Americans across the country have reported being harassed and verball… https://t.co/L5h26DoA1s"
positive,1.23495735510169E+018,"I have finally finished my #pencildrawing of @HamillHimself as Red 5, aka Luke Skywalker! It's my first attempt at… https://t.co/5WwCJrNyMC"
neutral,1.22251694822471E+018,Not Available
negative,1.22221685826012E+018,"Two embattled politicians — one impeached, the other indicted —announce an Israeli-Palestinian peace plan that the… https://t.co/EITl57FKZs"
negative,1.22228549346478E+018,Who needs Republicans with Dems like these? What an absolute embarrassment: Feinstein leans toward acquitting Trump… https://t.co/ejGuv66Vw4
positive,1.22367979430006E+018,"Saturday's are for hoodies, beer, and snuggling up on the couch to watch your teams. https://t.co/GSYpYX6Jpt"
negative,1.23237579599535E+018,Not Available
positive,1.23274162759826E+018,"Make your Wednesday cruise by with #BTSCarpool Karaoke on @latelateshow with @BTS_twt and @JKCorden, or as he is no… https://t.co/T8o2HDM6Az"
negative,1.23643668460413E+018,BREAKING: First coronavirus case confirmed in DC. I guess Trump was lying when he said this was all going to slow d… https://t.co/q6ubym5ajw
negative,1.23649012863543E+018,"As a result of President @realDonaldTrump’s leadership, every state lab in the Country can now conduct Coronavirus… https://t.co/h1KLDfXA1f"
neutral,1.23601091171583E+018,Not Available
negative,1.22409868556021E+018,Trump campaign ad to air #SuperBowl2020   LIES re: health care:  1) 29M cut off Medicaid in last 3 yrs; 875K VETERA… https://t.co/X13Xh44TPu
positive,1.23745803717199E+018,"One...man...band. @walterpayton 1977 season was just insane. If you haven’t seen this vid, watch it till the end. G… https://t.co/1WDGdbmCqq"
positive,1.23824185080641E+018,I know it's scary. I love you. Be patient with yourself and each other. We will get through this. We are all connec… https://t.co/8Cyu7rXiAE
negative,1.23845741316825E+018,"I'll say it again:  Whatever disagreements the Minister has with #abhealth workers, he should set them aside.  We u… https://t.co/sZN1kXDKwP"
negative,1.22412265712325E+018,Not Available
neutral,1.23627048162549E+018,"Keep an eye on Keith Richards. He’s my coronavirus barometer. If he goes, we all go."
positive,1.23475340882704E+018,Not Available
neutral,1.22250194907903E+018,Five MOST useless things in INDIA   1. Arnab's News Debates 3. Shah's Chronology 2. Modi's Election Promises 4. Pat… https://t.co/qxk2nJBphp
negative,1.22221302782877E+018,Not Available
negative,1.23624302469235E+018,BREAKING NEWS: SA confirms second case of coronavirus https://t.co/cv12UgCAuy https://t.co/AzC58WkuOV
negative,1.23677410421004E+018,White House officials are...frustrated at...Trump's consistent bids to downplay the severity of the outbreak. A c… https://t.co/zVuCUGLuyt
negative,1.23790482016338E+018,Senate Republicans blocked an emergency paid sick leave bill from moving forward to help with the coronavirus pande… https://t.co/YowKAXERnf
positive,1.23487198954366E+018,"@ProudResister I'm a Millennial for Biden. And not because of hand-waving about ""electability"" but because he's bee… https://t.co/XuqkPiZhUN"
positive,1.23772748812755E+018,Not Available
negative,1.23750026321013E+018,Not Available
neutral,1.23837783557774E+018,#Decentralized_Club will host AMA with @stealthsend at 17.03.2020 5.30PM(UTC) 10 winning questions Selected from Tw… https://t.co/hzJjxA9ToU
neutral,1.23604735795288E+018,Toilet paper does not cure #coronavirus...  SO STOP PANIC BUYING!
negative,1.23562738041431E+018,A letter - which was ultimately ignored - detailing why Ken Loach is a poor choice of judge for an anti-racism comp… https://t.co/e5dphFwQUs
positive,1.22341143955508E+018,Not Available
negative,1.23635955758614E+018,Who knew people rather starve than have a dirty a-hole?!🤷‍♀️😳😂  Zombie apocalyptic films NEVER showed panic buying/… https://t.co/oQE91XawHw
neutral,1.23722431753405E+018,Not Available
positive,1.23135504681985E+018,Off to watch Eva’s first Ukrainian dance performance of the season!! https://t.co/lAXpZgd9SJ
positive,1.23238102324312E+018,I see you back there 👀👀 https://t.co/HIshFO8Uxm
negative,1.22364812424746E+018,"America needs to wake up. GOP is willing to lie, cheat, &amp; steal for power. They have no shame &amp; no guts. They can’t… https://t.co/OePoZAZauZ"
positive,1.22098667951262E+018,Selected by Election Commission of India the for best election practices in Hyderabad City - Best Election Practice… https://t.co/IxWEF6D9E2
neutral,1.22220421017698E+018,"In a polarized age, no major party nominee is ""unelectable."" But some candidates are better bets than others. Berni… https://t.co/6SYgOr7NPC"
positive,1.23365745403188E+018,"how can i help people feel more connected to themselves, and to one another?  how can i create conditions for peopl… https://t.co/QKMpnH9W2r"
negative,1.23386937317521E+018,"China has recorded over 85,000 cases of Corona virus yet no one increased the price of safety products. Nigeria jus… https://t.co/KD7KrlhFTr"
neutral,1.22326219740667E+018,News: Imelda Staunton (!) will play Queen Elizabeth II (!!) in the fifth and final season of The Crown (!!!) https://t.co/WFD8x6vMMU
positive,1.23342703646467E+018,"On this date in 1983, more than 125 million Americans watch the 251st and final episode of the comedy-drama #MASH o… https://t.co/7ekOFQJXnf"
negative,1.23703776300812E+018,Not Available
positive,1.23311486146425E+018,"MJfam, I need your help. Was just thinking about how much I miss the sound of my uncle Michael’s laugh. Please post… https://t.co/ofJmhvoo24"
negative,1.22364518205646E+018,Don't overlook Fox News' role in all of this.  Trump's propaganda machine worked overtime to amplify his bogus defe… https://t.co/azJi3s2QA9
positive,1.22444749005475E+018,"The Kobe stuff isn't on my mind constantly like it was for a while, but it still hits me like a ton of bricks at ra… https://t.co/OmBdVi601w"
negative,1.23501899946279E+018,"I also guarantee you that your purchase of this mask, which is useless to you, restricts supply for frontline healt… https://t.co/vA0p7tx9lq"
neutral,1.22241822708876E+018,Including the highest-ever Welsh Conservative poll rating for a National Assembly election:  The First Welsh Politi… https://t.co/stjLz4SyFd
negative,1.22221406802876E+018,"When Trump praised Pompeo for doing ""a good job"" with @NPRKelly, ""the room then broke into laughter and journalists… https://t.co/FIuReuOllp"
positive,1.23422405940102E+018,Klassic #80sKISS....Just ‘cause I feel like it! https://t.co/KttgTXGxzY
positive,1.22363070203551E+018,"Thank you, Mr. President—and thank you for all you do for America every day! https://t.co/CFZ2xMuajr"
negative,1.2373783841891E+018,It cannot be overstated just how fucking dangerous this is. https://t.co/sqTU5sbYqy
negative,1.23379618157636E+018,"The last time #nufc scored, the UK was in the European Union and no-one had ever heard of the corona virus."
neutral,1.23507418520386E+018,young people don't vote is a heckuva way to turn obstacles to voting faced by people with limited resources into… https://t.co/8jnDByApcy
positive,1.22424727717641E+018,"Happy birthday @aseefabz, every day I watch with pride as you grow into a strong, beautiful, independent woman. May… https://t.co/u4VLCHfUL1"
positive,1.23380795774336E+018,sorry for the technical issues the #PHOBIASVIDEO is out now everywhere!! this ones really special. come watch with… https://t.co/oH41nqFM2M
positive,1.23367032026486E+018,I’m not a rapper.  I’m an artist. I’m not an artist.  I’m a human.  I’m not a human ... I’m an alien.  Or at least… https://t.co/yp8YzjrUZc
positive,1.22306050298248E+018,"Pokémon Sword and Shield news: Gigantamax Alcremie is no longer in the event pool for raids, but its been replaced… https://t.co/Jt58wCFIbA"
neutral,1.23524913848219E+018,"I have been in despair for a few weeks, certain that the Democrats were going to blow this, and I feel much more op… https://t.co/xgTeXbK5tV"
positive,1.22381464866488E+018,Not Available
positive,1.23307734532345E+018,Not Available
neutral,1.22228567278825E+018,"should Senate convict/remove Trump?  whites w/out college degrees: 31% yes, 65% no all other Americans: 55% yes, 39% no"
positive,1.23451426454045E+018,i get so consumed with taking a 'perfect' picture to make myself feel good. so fuck it. here's me not caring for on… https://t.co/rZYQPQTUQc
positive,1.22323108304459E+018,#MissAmericana is on @NetflixFilm! I’m excited for you to see it. I want to thank Lana Wilson for her curiosity &amp; f… https://t.co/MpwilaD3tv
negative,1.22257410735254E+018,I see Alastair Stewart has been sacked and accused of racism for quoting a lengthy passage of Shakespeare. Disgrace… https://t.co/5nNyNFmx4P
positive,1.23824646036328E+018,Not Available
positive,1.23631099053235E+018,Can I just say I couldn't do my job without all the agents out there! The people who go to endless showcases and ul… https://t.co/1qMdnWzVPq
negative,1.22222074950896E+018,Not even a pretense of realism to Trump's one-sided plan to legitimize Israel's war-crime settlements. This latest… https://t.co/8qbkoAg7kW
neutral,1.22176656508503E+018,Yesterday I released an official statement in respect of the re run election in my constituency. The full statement… https://t.co/vNJJGALDRf
neutral,1.23327022729264E+018,Characters in JJBA who are NOT white Avdol Pucci Weather Tiziano  Mariah All of the Pillar Men Hermes  Feel free to… https://t.co/zzl6TUWySn
positive,1.22390998561008E+018,"This was not and will not be a ‘foreign flag’ in the UK.  If not for the European Union, it is also the flag of the… https://t.co/MKj32DztiN"
positive,1.23645160748899E+018,Not Available
neutral,1.22409714420802E+018,LOL imagine living in Europe and not having a Super Bowl
positive,1.23655870923878E+018,Fed up with all the bad news about #coronavirus ? Let’s start a happy thread showing off all our furry friends. I w… https://t.co/K2KLuSHTNT
neutral,1.23632411560427E+018,"As schools in the US close and students are supposed to study remotely, a reminder that 6 million kids don't have I… https://t.co/vMV13p2YBi"
positive,1.22411761567885E+018,Not Available
positive,1.23471382960859E+018,Thanks for all of the #WhiskeyCavalier love. Still miss it. Glad you all feel the same.
positive,1.22362763056767E+018,"Got jumped last might, but at least found out a titanium leg makes a great weapon😂 https://t.co/Nv80SdS3gi"
neutral,1.22228500279429E+018,how narrow is Trump's base?  approve/disapprove from today's Quinnipiac national poll  whites without college degre… https://t.co/4EbKmMsZyz
positive,1.22416544310099E+018,The best birthday gift has been the support of all my fans and the most amazing and hardworking team an artist coul… https://t.co/0b8nXgcAOs
positive,1.23684052238117E+018,I really like this photo. That is all. 🖖🏻 https://t.co/JoiJTuGIea
neutral,1.22369038413346E+018,Breaking News: Bruno Fernandes leaves Man United and joins Wolves after realising how shit they are #OleOut https://t.co/XdBXsh1EcY
neutral,1.238816359016E+018,"It’s time for #ShamelessSelfPromoSaturday!  Drop your links to your #book, #poems, #ebook, #blog, #audiobook,… https://t.co/iuAx2CYfEv"
negative,1.22221868001833E+018,Trump praises Pompeo for shouting obscenities at @NPRKelly and then putting out a false statement about her that wa… https://t.co/YXUWfTTADC
neutral,1.22364325323425E+018,Let me tell you ahead of time what's going to happen today on cable news: Everyone is going to viciously attack… https://t.co/0m3VM9eTG0
neutral,1.23286336596344E+018,AUGH i feel like @SlackHQ has not thought through the edge cases of allowing users to specify arbitrary text for li… https://t.co/3Z27tyRsyU
neutral,1.23826562115615E+018,Read an article that the bears were coming out of hibernation early so I’m going to find them maybe they know what… https://t.co/KCLOScrGhT
positive,1.22411835181271E+018,Chunk it! 🏈 #SuperBowlSunday https://t.co/AZqyhRFKYS
positive,1.23384563242873E+018,um i just woke up and we're at 1.4k on twitter now? you guys are incredible !????????? also hi btw i know i usually… https://t.co/kwZdOifXDP
negative,1.23315678404455E+018,Not Available
positive,1.2342093553413E+018,I feel like I'm tagging the same handful of friends on almost every #writerslift I encounter. I'm a little nervous… https://t.co/5ZHuld6SS3
positive,1.22329679508792E+018,Not Available
positive,1.23850250730908E+018,hi all. i had planned on saving this piece for a secret event i was doing in the spring thats now gone. all my even… https://t.co/g61X2PQYsC
positive,1.23410949122375E+018,"Yaaaaas, blocking feels soooooo gooooood!!! #VoiceTeensAwesome"
negative,1.23642232976642E+018,“...the Trump administration’s attempts to forestall an outbreak of a virus now spreading rapidly across the globe… https://t.co/NpzKvqe6sa
negative,1.2359444235587E+018,what the WH is saying on coronavirus this morning as it spreads rapidly:  TRUMP: “We closed it down...we stopped it… https://t.co/0so5mKuWqo
neutral,1.2362708052958E+018,🦠 Bad. My healthcare provider @Cigna will only pay for the coronavirus test. But if we test positive it’s on us. Wi… https://t.co/McMl6PbUsB
negative,1.23777528878156E+018,Meghan Markle looks chic in £855 tan dress for secret meeting with Harry in London #royal https://t.co/ktwi5ETvjX https://t.co/5F676H8im9
positive,1.22384551180896E+018,Not Available
positive,1.23699467064063E+018,Today is my birthday!! 😊 As of today I am 28 years old 😁🎂 https://t.co/iF0XAra7T0
negative,1.2360472517028E+018,Not Available
neutral,1.22332547678723E+018,NEWS: The THRESHOLDS for the  Feb. 19 debate are here and they are drastically different. Candidates need 10 percen… https://t.co/Td9Bi1p04Q
neutral,1.23588097703508E+018,It’s been awhile since we’ve had a good #FollowFriday and it seems like #MedStudentTwitter is growing at an exponen… https://t.co/sdkIyran88
negative,1.2367080145745E+018,WTF is a British SAS operative doing in southern #Syria?? The blatant violation of #Syrian sovereign territory &amp; ai… https://t.co/vVM21M8Dyy
positive,1.22409184715846E+018,Not Available
negative,1.23655813448909E+018,"On International Woman's Day British Racism in the 21st Century.   @guardiannews targets Priti Patel , Home Secreta… https://t.co/vojD96Pg09"
positive,1.23317746639672E+018,Not Available
neutral,1.23698438827501E+018,Not Available
neutral,1.23595881700916E+018,"Double standards aside, the coronavirus is not a joke and the thousands of deaths worldwide are not to be taken lig… https://t.co/OwRyAkYc94"
neutral,1.23596641089702E+018,"in California, there are likely several thousand people who have been exposed to COVID-19. but only 516 people have… https://t.co/qG8dVeiMvM"
negative,1.22223706599323E+018,"Not a good sign, and the opposite of an endorsement: The ambassadors of Egypt and Jordan, the only two Arab countri… https://t.co/Kt0pl3TNFD"
neutral,1.22381789601233E+018,Terrorist cosplay is a bizzare hobby. https://t.co/JqPTl0KQs0
positive,1.2240905564873E+018,Not Available
positive,1.23665285272406E+018,To those who now have 28 packets of pasta. Those searching the black market for hand sanitizer. To those walking ar… https://t.co/1ofoYhrzH0
positive,1.2350071233035E+018,#MONBEBE thank you for all of your support during our US promo week. We love you #AllAboutLuv… https://t.co/mmm59eNTga
neutral,1.23449085597892E+018,"While I get it , this feels wrong in many ways #QConLondon https://t.co/r9zGlCzzDM"
negative,1.22268745978136E+018,"It's an argument for autocracy. By Dershowitz's logic, a month before the election couldn't Trump, viewing his re-e… https://t.co/PZ5zN5i7md"
positive,1.23430187681382E+018,I feel bad Pete Buttigieg dropped out of the presidential election he was my guy that's who I was gonna vote for bu… https://t.co/pJg3U7xUpv
negative,1.23637679744658E+018,Matt Gaetz made light of coronavirus by wearing a gas mask. Now one of his constituents has died. https://t.co/iqihtaFhCt
positive,1.2328034251607E+018,As seen in western NY: https://t.co/tFTf6t38Pg
neutral,1.23650002335089E+018,Thought for Sunday: 34 people affected by corona virus so far in India; 53 people killed by communal virus in Delhi… https://t.co/FTLTbeHUZu
negative,1.23641603721151E+018,"@PhilipWegmann I was told coronavirus was a ""hoax"" perpetuated by Democrats https://t.co/shK2SRps80"
negative,1.23648683249124E+018,The White House overruled health officials who wanted to recommend that elderly and physically fragile Americans be… https://t.co/CHN1TJXCsd
negative,1.23589952779161E+018,This is not a drill: #WHO accuses countries of taking too lax an approach to the #coronavirus outbreak. #COVIDー19… https://t.co/mFJpOcYAFt
neutral,1.22410285277304E+018,How Jimmy G practicing handoffs for the Super Bowl https://t.co/fC7emZCb8v
negative,1.2364221430402E+018,The one previous crisis not of Trump’s making was Hurricane María. The administration response was horribly botched… https://t.co/1R7FtDuWG2
neutral,1.22409168749396E+018,"Florida ""Assault Weapon"" ban comes 80% SHORT of enough signatures to put it on the ballot.  https://t.co/mtJzb59sBd"
negative,1.23609594917024E+018,"That S.Korea has already tested 140,000 people while we, with a test kit shortage, have tested only 1900 is the res… https://t.co/KBxNTHrjV4"
negative,1.22228198539517E+018,Feinstein suggest she is leaning towards acquitting Trump in the impeachment trial. https://t.co/RDcapUkXse
negative,1.23792253493651E+018,"In last *24 hours*  1,000+ coronavirus cases in US WHO declares ""pandemic"" Dow enters bear market Italy closes biz… https://t.co/UotuqHT7zz"
negative,1.22082356876781E+018,"McKenzie asked Sport Aust to consider 9 new/amended applications after closing date, 2 months before May election.… https://t.co/P0stWGc18l"
negative,1.23781205998067E+018,OUTRAGEOUS: Senate Republicans just blocked an emergency bill to provide paid sick leave to workers impacted by the… https://t.co/PNbFaop60O
negative,1.22316076972385E+018,"Here, @BJP4India's Karnataka handle takes responsibility for the Delhi terrorist. Thanks for this honesty. https://t.co/z2WTQIe9C3"
negative,1.23780749250518E+018,Not Available
negative,1.23600843879618E+018,The Govt’s approach to Coronavirus this week has fallen “woefully” short. https://t.co/kGXHqyfaBm
positive,1.2334974515098E+018,"Doesn’t feel real, but I’m happy to announce I’m represented by @qnrisawesome!  At 12 I wrote to cope w/ cancer dia… https://t.co/Y2YXrQ7HoH"
neutral,1.23598280701853E+018,"no one:  strategists: our modern world is more DIVIDED than ever, the more CONNECTED we are the more DISCONNECTED w… https://t.co/23qLRFfq1a"
positive,1.23746968814308E+018,"This is the price THEY pay for Bacon, Pork chops, Gelatine (Candy).   They've never felt love or something positive… https://t.co/FJdhGk5gub"
positive,1.23826252390595E+018,A Mamma Bear with her Cubs🐼🐾🐾🐾🐾🐾🐾😘  It’s not the bear that’s crossing the road. It’s the road that’s crossing the f… https://t.co/4xr4E4Qebc
neutral,1.23620552914126E+018,Not Available
positive,1.22407822309036E+018,"ARMY, have you checked out the #EgoChallenge yet on TikTok? Why not join to help promote the song and also have som… https://t.co/QZ3hhBJQwI"
neutral,1.22413324529542E+018,@MrPeanut may be a baby now but he has some words of wisdom for us all.   Welcome Back! #BabyNut #Ad https://t.co/ZvHmZx7C0v
positive,1.23637596402994E+018,"Sinfin, Derby. Yes Sir, thank you for pointing out your foot is trapped. It's trapped because you and your mate wer… https://t.co/TCN7CFwGKd"
negative,1.23564129700571E+018,Horse slaughterhouse workers exposed for beating former racehorses with pipes   https://t.co/t2IJ1aEbg7
negative,1.23251832684216E+018,"Before this gets off the bad faith rails any further, at tonight's #DemDebate, @PeteButtigieg was being critical of… https://t.co/ZfRxn61jdG"
positive,1.23595993306707E+018,"The Romantic Adventures of Gobbarian the Tsundere and the Orcward Fighter 😊  More art block-busting art, now featur… https://t.co/X2xY9Zb1Fm"
neutral,1.23783740281666E+018,One person connected to #UDel has tested positive for Coronavirus. The individual is receiving medical care in a qu… https://t.co/kxOHKDuqNe
negative,1.23329958240833E+018,COVID-19 Advice!  Remember to cover your nose &amp; mouth when coughing or sneezing with a cloth or in your flexed elbo… https://t.co/V40yT4oNlJ
neutral,1.23415397073994E+018,Not Available
neutral,1.23494893702871E+018,How many ults do you guys have? I feel like I have more then most people.  https://t.co/iqgeYjFv4B
positive,1.23422900775284E+018,"Harry and Meghan being the most adorable couple ever, a thread.  (feel free to add pictures): https://t.co/pStAS11RC8"
positive,1.2337111992605E+018,I feel deeply honored! https://t.co/EpPO74A0j1
positive,1.23883718834904E+018,"HEY TTRPG COMMUNITY! With so many cons being cancelled due to COVID19, we are looking to collaborate with other Twi… https://t.co/9V3Me9VSC3"
negative,1.23902612349891E+018,Why would #CoronaKatie and the Governor of Oklahoma both post virus-truther photos of themselves on the same night?… https://t.co/4qBlG7rKt6
