True Sentiment,Tweet ID,Tweet
negative,1.22222622944675E+018,Deputy White House counsel Pat Philbin on the Senate floor: “How are we supposed to get the proof of what’s inside… https://t.co/n17paLcT2I
negative,1.23628964973737E+018,Panic buying and stockpiling of toilet roll continues. These are the scenes at Costco in Farnborough in Hampshire t… https://t.co/T0Xsyd8p1L
positive,1.23748970509E+018,Not Available
negative,1.22225831485717E+018,"It’s Super Bowl week, and Trump is using a prevent defense. The strategy sometimes backfires iN football. It may fa… https://t.co/qEtKj1JHga"
negative,1.23643264837486E+018,Turns out Donald Trump was potentially exposed to coronavirus when he was at CPAC. Maybe someone should let him kno… https://t.co/gUBIMYq5gT
positive,1.23392522569749E+018,Had a totally surreal author moment at B&amp;N today. For years and years and years I’d walk into every bookstore and i… https://t.co/CNYMWJNaDp
neutral,1.2236317137981E+018,"Forgive me, but I have to say this: imagine if Barack Obama had referred to himself as ""America's Greatest Presiden… https://t.co/a8CSR8g4Tz"
negative,1.2361289393761E+018,Arkansas can only test five patients for Coronavirus per day.  Maine can't test any yet.   Washington State has a b… https://t.co/IWjBtwCSqq
negative,1.22254087358756E+018,The ban imposed on #kunalkamra by 4 airlines is the act of a coward leveraging his influence with the Govt to silen… https://t.co/QteHY2jkK8
neutral,1.22307064596729E+018,Hamas terrorist Khalil Ibrahim Al-Shuntaf died today while digging a tunnel to help kill Jews.  Baruch Dayan HaEmet… https://t.co/UD2MLMoQuI
neutral,1.23710679475898E+018,"omb fam it's time! sierra, jason, and diego are here answering your questions live, follow along using #AskOnMyBlock"
positive,1.23613996724128E+018,"The 87-year old patient stayed in Wu Han hospital for nearly a month, haven't see the sunset since then. On his way… https://t.co/j65LrVotER"
negative,1.23732956195367E+018,@amandacarpenter Will the WH answer reasonable questions about what Trump’s own hotel and resort business stands to gain from this?
neutral,1.23446394287498E+018,Ok Star Trek friends.... I want your opinion. How do you feel about this being sold as a shirt? I'm pretty offended… https://t.co/DUAz2lcEwJ
negative,1.22130474993866E+018,Thousands of Palestinians mourn the body of the child Qais Abu Ermila in the blessed Al Aqsa Mosque. The child was… https://t.co/6UYDhrspWZ
negative,1.23791162533784E+018,So this dead-on-arrival speech from Trump does underscore that virtually every major international issue the US fac… https://t.co/Dt5gYpbTya
neutral,1.23585126428763E+018,"I spent 18 months writing a 300+ page book on the history of nerve agents. I’ve got over 20,000 pages of documents… https://t.co/Bxtyua0oQp"
negative,1.22356859570113E+018,Wow-Pence either does not know that Trump is rolling back Medicaid or he is a really good actor. This is how little… https://t.co/LTDZpkcogr
negative,1.23610303373557E+018,NEW: ‘Maybe I have a natural ability’: Trump plays medical expert on coronavirus by second-guessing the professiona… https://t.co/s42vHqxYl4
negative,1.22342885061025E+018,Not Available
neutral,1.22347561706216E+018,Sure is gonna be something seeing performative woke Twitter start trashing America’s first two Muslim congresswomen… https://t.co/7Dgx0lKpS5
positive,1.23458828726992E+018,Not Available
neutral,1.22256238384919E+018,Can’t wait to see how media will spin this into another victory for Beto.  Dems targeted this race and they lost by… https://t.co/tOviWDitUj
negative,1.23622600676518E+018,I think I may have found the #coronavirus super spreader  https://t.co/oAx3Xk59ZC
neutral,1.23634217581151E+018,"@FLOTUS @WhiteHouse At least 314 people with the Covid-19 illness have been treated in 28 states, and at least 17 p… https://t.co/zK2Pk5g9GV"
positive,1.23251890238881E+018,I feel like the most powerful witch to have ever touched the earth  #FFXIV - #ff14 - #roegadyn - #femroe https://t.co/BvuOY719YV
positive,1.23838474526179E+018,The secret’s out.. I’m swapping one ballroom for another! From September 2020 I’ll be waltzing around the UK &amp; Irel… https://t.co/rDZ4ANhJvv
negative,1.23448242834292E+018,Florida has now declared a health emergency over Coronavirus and the number of cases in US tripled since Wednesday… https://t.co/8JtvlNEXXW
positive,1.22271456630142E+018,No more #SmokeAndMirrors.  The president has confessed to everything he’s been accused of.  He asked a foreign powe… https://t.co/52zPYnCBdc
negative,1.22196361080242E+018,Wow. So according to #Dershowitz if a President abuses power there is no remedy at all no matter how destructive it… https://t.co/kik3e4jGNf
neutral,1.23456711749367E+018,Not Available
neutral,1.23839493636355E+018,Not Available
neutral,1.23690783135542E+018,If the coronacrisis in the UK becomes nearly as severe as Italy (still if) the British state will have to be reconf… https://t.co/LR5Kr9LIfr
positive,1.22230323265291E+018,"In case y'all thought we weren't on task today due to your little hissy fit fake temper tantrum, think again.… https://t.co/WrXfMKU6jn"
neutral,1.23305470006233E+018,Not Available
negative,1.23713232626757E+018,Morrison speech:  -Links response to 'patriotism' -Encourages employers to pay all their workers sick pay &amp; pay the… https://t.co/HJ3szbJQFN
neutral,1.23743356060642E+018,"1st degree block- When you have a direct confrontation with a tweep&amp; get blocked.  2nd degree block- When you ""kiki… https://t.co/arNyO1OeR4"
neutral,1.2360093782951E+018,"UNIVERSITIES: We might need to go fully online if coronavirus hits campus  PROFESSORS: OK, how exactly?  UNIVERSITI… https://t.co/VOd1KnQVFK"
negative,1.22358724986823E+018,If I was a Tory MP today I'd be shitting myself. For 47 years they've been able to blame every terrible consequence… https://t.co/1nDjJht2Ph
positive,1.23527744905261E+018,Tell me Rue... how’d it feel ?🖤 https://t.co/jrQL0smkG9
negative,1.22308763043229E+018,Kid gets expelled for playing porn intro song. I say bullshit! Kid is as talented as ever! Boycotting this suspensi… https://t.co/pgp1HYWtM3
negative,1.23645356668188E+018,One of the four patients in New Jersey who tested positive for coronavirus after initial testing apparently travele… https://t.co/sS4Bj8tFtN
neutral,1.23644868046879E+018,"NBA has informed teams that all should have guidelines for coronavirus in place by March 10, such as: - Arrangement… https://t.co/HXhss4wGBI"
neutral,1.23827283919683E+018,"Agent Peely, Hybrid, and Zenith have been ELIMINATED!  Vote for the next three you want OUT!! https://t.co/BYnKe2ZYKB"
neutral,1.23211869069661E+018,MLB: we want more people to watch games  fans: can i watch my team without being blacked out?  MLB: maybe we should… https://t.co/F9Nx5lf3CP
negative,1.23377122369335E+018,Anybody who thought the Hong Kong protests were *over* should have a look at these scenes from Mong Kok. It only ta… https://t.co/QU5oUcjaBF
positive,1.23463533742041E+018,Didn’t touch you but still made you feel me https://t.co/9yaSMZJh5e
negative,1.2363909419818E+018,"Public concern about the spread of the #coronavirus is rising. President Trump, meanwhile, evidently decided that t… https://t.co/tlo0kcPeUX"
negative,1.23777988379276E+018,"As a Brit, one of the most grating aspects of this case has been the determination of Weinstein’s lawyer to litigat… https://t.co/RpzBQckKvY"
positive,1.23466242973427E+018,"When you feel like giving up,  remember  why you held on for so long in the first place  (The Pilgrimage, by @paulocoelho )"
negative,1.23339317507671E+018,"Someone who I'm guessing didn't watch much Jeff Okudah last year asked him about having ""a tendency to get kind of… https://t.co/pJDl8v4FNt"
negative,1.23558473109546E+018,Not Available
negative,1.22356266327334E+018,Top Democrats Say They ‘Won’t Accept Trump Acquittal as Legitimate’ https://t.co/lD4VhhlcUv
negative,1.2326460183297E+018,Not Available
positive,1.22222629549873E+018,"At the end of the day, @BernieSanders gets out the vote and beats Trump. With the help of @AOC and @MMFlint https://t.co/EwstmvBpFB"
positive,1.23457988837745E+018,Tomorrow in CA I will #ChooseWarren as I have long planned to do. If you feel the urge to lecture me right now abou… https://t.co/TwrIZsLZmB
negative,1.22361449141533E+018,"Somewhere in Wuhan, three unknown people are wearing protective clothing but holding guns @SolomonYue… https://t.co/NBPCBBCvKB"
positive,1.23257213584092E+018,"I feel like celebrating the fact that it didn't actually rain at sunrise this morning! It was, however, blowing a g… https://t.co/InXXrOtoEL"
neutral,1.22330758148311E+018,"UPDATE: Viktor Shokin, Ukrainian Prosecutor General Biden wanted fired just filed a statement to Ukrainian law enfo… https://t.co/tilTqz25MG"
positive,1.22411649751943E+018,#DemiLovato killed it with her powerful rendition of the National Anthem! 🇺🇸Thoughts? #SuperBowl https://t.co/nvLObkZW19
neutral,1.23649167778066E+018,This is an outrage. https://t.co/oPFaLk4lt9
negative,1.23258906747011E+018,"It's shameful and downright inhuman to cheer for a deadly Virus to spread - and enjoy seeing people suffer for it,… https://t.co/jAgqQLc9Cc"
negative,1.23630643449061E+018,"Big newsrooms may need to take political reporters – and editors on the political desk – ""entirely out of the loop""… https://t.co/cIg2Jkcqpf"
neutral,1.23415320326194E+018,Not Available
negative,1.22360782753877E+018,Is there anything Trump won't politicize? No. The ghastly story of the doctored weather forecast https://t.co/YHWxghqtqh
neutral,1.23364046637923E+018,@bIondiewasabi if u cant respect gibby then feel free to leave https://t.co/cwmgT49HMC
neutral,1.2377292437543E+018,Entropy is the measure of the disorder of a system.   Ex: A block of ice will increase entropy as it melts. As ice… https://t.co/JcTinSCHtG
positive,1.22410102325962E+018,Not Available
negative,1.23636309007104E+018,what our president has done to fight the coronavirus: - praised himself - called it a hoax - blamed Obama - worn a… https://t.co/VtwukRU6FS
neutral,1.22253553599616E+018,BREAKING: Chicago Cubs third baseman Kris Bryant has lost his grievance against the team seeking an extra year of s… https://t.co/K4QUGpCeDq
positive,1.22420051687759E+018,Continuing my 90th birthday celebrations with another 2/3rd of my family coming from all over the country.… https://t.co/dsxZ78LX8T
negative,1.23740756716225E+018,"Yes, unless you’re old. https://t.co/SC7zcQguIA"
negative,1.23701150601904E+018,NDTV’s Nidhi Razdan interacted regularly with Twitter account of ISIS suspects who instigated Muslims to join anti-… https://t.co/SY2mhCtSWh
neutral,1.22220092321418E+018,Senator @RonWyden &amp; I are sounding the 🚨🚨:   Trump administration is pushing a proposed RULE threatening earned Soc… https://t.co/8PZvoXIlek
neutral,1.22224883011416E+018,"New national Quinnipiac poll: 75% (!) of voters, including a 49% plurality of Republicans, say witnesses should be… https://t.co/1FRPiz15uQ"
neutral,1.23637016397026E+018,How the fuck did coronavirus get to Far Rockaway  You can barely get there on the subway
positive,1.22355586800593E+018,"Before he made Castle in the Sky, Miyazaki was in Wales, supporting the miner's strike.  He based the landscapes in… https://t.co/j5i2obuxxw"
positive,1.22260248019999E+018,Good News!! Ramon Bueno was sentenced to 85.5 years in prison for shooting me and shooting at Tpr Rey Cruz and Tpr… https://t.co/YYvTyc1kTN
neutral,1.22313577767416E+018,Plz@@atiku help us 🙏🏻🙏🏻🙏🏻🙏🏻🙏🏻🙏🏻🙏🏻🙏🏻this is a video clip of the news paper of the incident that happend at ikeja can… https://t.co/pFGqpeKgQy
neutral,1.23602949481894E+018,I think we’ve reached the point where we can say it is a statistical impossibility that Turkey does not have a sing… https://t.co/U0GcBFUclo
neutral,1.23609411855348E+018,"“Flabbergasted” that a sick doctor would keep working?   Um, sick doctors working is the backbone of our health sys… https://t.co/OGQAuKs19c"
negative,1.23610786056981E+018,Costco banning free samples over coronavirus. https://t.co/usFpGHijEY
negative,1.22361489903465E+018,It is a sad day for America to see Senator McConnell humiliate the Chief Justice of the United States into presidin… https://t.co/Ffl5rBJiju
negative,1.2369503260092E+018,"A 93-yr old Nazi found living in Tennessee, still receiving WWII pension AND receiving Social Security checks is be… https://t.co/LjuKdh7q0m"
negative,1.22441565802223E+018,Happy birthday to my sister in service @AyannaPressley!  You disrupt the status quo and embrace who you are. And yo… https://t.co/xruo6uihqU
neutral,1.22396739271753E+018,Not Available
neutral,1.23636477592964E+018,B.C.'s provincial health officer teared up discussing the impacts of the novel coronavirus on senior citizens durin… https://t.co/yvssXAcBn1
neutral,1.22229211107E+018,Senator Dianne Feinstein is conforming that today’s LA Times report about her leaning toward acquitting Trump is FA… https://t.co/egzAA2ybKc
positive,1.22426003396751E+018,We're giving you and your someone special the chance to watch the latest film at your local Cinema! To win just tag… https://t.co/5eiRzl7BHq
neutral,1.22365222826487E+018,Tomorrow the #Trump campaign will be spending $11 million on one single #Superbowl ad. Trump does not tell the trut… https://t.co/7g5e3t5O3u
neutral,1.23165269192491E+018,How old were you when Airplane Conversations was released? https://t.co/WnU9icLWjO
negative,1.22228105915871E+018,Democrat Diane Feinstein leans toward acquitting Trump as his lawyers end their impeachment defense arguments https://t.co/979F6feJke
negative,1.2364014996071E+018,"#Breaking: Netanyahu plans to mobilize children, who ""thank G-d"" are not affected by #coronavirus, to disinfect Isr… https://t.co/rkVFHXwDxJ"
negative,1.22324275030233E+018,"On impeachment, @RandPaul says election 'chaos' is goal of Democrats, 'they hate the president so much'… https://t.co/LalUVodCpq"
positive,1.2230957978325E+018,Gotta wonder...did Susan Collins issue a statement that she was voting YES on witnesses and more documents because… https://t.co/E5JRnMixdi
positive,1.23256094290448E+018,Mum feels a bit crappy this morning  But my whiskers are as amazing as ever!!  Happy #whiskerswednesday everyone!!… https://t.co/By3sk9vz8T
positive,1.23456819060204E+018,--I was honored when MJ wanted me to play the younger him. Won't ever feel real. #GOAT!!!! https://t.co/kUcdrtguAX
positive,1.23385685973765E+018,Not Available
negative,1.23647479980908E+018,PENCE was set to evacuate infected Americans from a cruise ship. Then TRUMP stepped in — worried how “the numbers”… https://t.co/g1g4U4xqc6
neutral,1.2363243921807E+018,Not Available
neutral,1.23520444336221E+018,"Let's talk about school closures re COVID-19. It's a tough topic, scientifically and pragmatically. It's hard to es… https://t.co/DEnzhGl3zH"
negative,1.22291714222964E+018,Never got to report this. The morning after the election I got a call from a high level source. Said they’d take a… https://t.co/oICkyYThgf
neutral,1.23738284369471E+018,Fun fact: Nintendo used to compete with Lego using their own N&amp;B Block. https://t.co/fLLp39dRtg
neutral,1.2222053797964E+018,President Trump's former chief of staff John Kelly says he believes John Bolton and believes witnesses should be he… https://t.co/B12kVJDyy6
positive,1.23685431955661E+018,"EXO-Ls have donated 12,480,000 Won to help those that has been affected by Corona 19   Following the footsteps of E… https://t.co/vS58qsv2bW"
negative,1.22160751563026E+018,"It’s hard to save enough for a decent retirement, and it’s only getting harder. That's why I've got a plan to incre… https://t.co/EVRYmZKcC7"
positive,1.22437911740512E+018,Happy 85th Birthday to the legend that is Bobby Harvey aka Ma wee da’. Took him for lunch. ‘I just want soup’. Then… https://t.co/To72LoGwgM
positive,1.22377294099243E+018,I’m officially a year older today and much cooler than ever. Happy birthday to me. Say a prayer for me when you see… https://t.co/pjTN0kKMIA
positive,1.23347125026729E+018,I just got a pixie cut again &amp; I feel more powerful than ever https://t.co/rvLsQwYcn3
positive,1.23755161195566E+018,I’m gonna need everyone to say a big Thank You to Black America. If it wasn’t for our voting block voting in massiv… https://t.co/qFKrKiRwLY
positive,1.23499674703161E+018,Kim Woo Seok reportedly to take the main lead role in drama 'Twenty Twenty' produced by PLAYLIST which is famous fo… https://t.co/R1kZnWmyv7
negative,1.23615410598024E+018,"I'm extremely saddened to learn of the first fatality in our district from coronavirus, a Northwest Floridian resid… https://t.co/FKLcx0BG6d"
negative,1.23853688833779E+018,Breaking: travel agents tell me...  • Air Baltic  • Norwegian  • Korean Airlines  • Cathay Pacific  • TUI  • Virgin… https://t.co/rHkL6ibgYr
neutral,1.2222557797236E+018,"If the Senate won’t get rid of Trump, it will be up to us to get rid of them."
negative,1.22410016761748E+018,Trump spent $10 million on a commercial for tonight’s #SuperBowl.   We fixed it for him. https://t.co/7LFdugeeUj
negative,1.23663576408933E+018,Not Available
positive,1.22411422668111E+018,"It’s my honor to be in my old stomping grounds of MIAMI to intro the NFC &amp; AFC CHAMPS.  Today, I live vicariously t… https://t.co/APPv5SyhXL"
negative,1.23803542436862E+018,"South Africa is already facing an economic crisis, loadshedding, an already overburdened health system, not enough… https://t.co/mDeGndHTQq"
negative,1.22323689437429E+018,GOP+handful of Dems forming Bipartisan coalition to acquit @realDonaldTrump later today-By obsessing on his ouster… https://t.co/pS9im6PX9p
positive,1.22323264741931E+018,"I predicted a swift acquittal last week. Get ready to see indictments drop on the other side, the foreign governmen… https://t.co/8MTK1OzYa9"
negative,1.23232582748996E+018,"@DailyLimbaugh The coronavirus is of the same strain as SARS. I don’t listen to your show, but I ask that you infor… https://t.co/fLdGGABMx2"
positive,1.23660294889091E+018,Not Available
positive,1.22375516967173E+018,A privilege to spend his birthday with one of my favorite humans @BrentSpiner HAPPY BIRTHDAY BRENTO https://t.co/Q4FNNufjL5
negative,1.23609943267372E+018,A doctor in Victoria has been diagnosed with coronavirus after returning from the US with flu-like symptoms. He tre… https://t.co/2X10DSZMbB
negative,1.2359553384001E+018,"This is a headline from California  ""Chaos at hospitals due to shortage of coronavirus tests""  https://t.co/TPtdR6Uoy5"
positive,1.23727128615548E+018,"John Reid lost his 16-year old son in a car crash. He donated his son’s organs, including his heart. One year later… https://t.co/UJBk2Y8E97"
neutral,1.22099401695262E+018,Not Available
positive,1.2374688397739E+018,"In case you feel like your weight loss goals are taking too long, keep in mind this has taken me SIX YEARS of succe… https://t.co/sxqXU9kS8t"
neutral,1.23499114550928E+018,"Anyone else think the character's eyes in 'Connected' look too... surprised? I'm no expert, but they seems too exag… https://t.co/oMSTvse7Gf"
negative,1.2236021703539E+018,"Hillary Clinton took on Trump when he slandered these women. She worked to support women's races in 2018, which ele… https://t.co/F860kvoUfw"
negative,1.234855405463E+018,Not Available
neutral,1.22346095959701E+018,Chuck Schumer has been in office for 38 years  Nancy Pelosi has been in office for 32 years  Maxine Waters has been… https://t.co/o4SWitY2Uc
negative,1.23599862973279E+018,"In the last 24 hours, I’ve spoken to lots of sources on the Hill and in the White House and I’ve become convinced t… https://t.co/y5RECQB3SD"
negative,1.22358384288536E+018,Further proof of the awful campaign being run by @BernieSanders who is waging a campaign against the Democratic par… https://t.co/riQlVeEDBM
negative,1.23370570393789E+018,North Korea shot their first confirmed case of #COVID19 to death.  Israel will have a vaccine for the virus ready i… https://t.co/lsBEivblE4
positive,1.22346319565166E+018,Damian Lillard told me he was walking into church when he saw the news about Kobe on his phone. He said even after… https://t.co/vUEqfWj3bM
negative,1.23716253158574E+018,Today in WTF #mnleg bill introductions: public libraries that host story hours that include drag queens get FULLY D… https://t.co/e4pKGBFtic
neutral,1.23197236808141E+018,WATCH: NOTHING IS HAPPENING!!! I'm telling y'all this wrecking ball is WAY too small!!! #leaningtowerofdallas… https://t.co/7tM4sGlltu
neutral,1.22326618073714E+018,Let’s say Ukraine announced an investigation into the Bidens. How would this “rig” the 2020 election? How many Amer… https://t.co/hzWVh19fhz
positive,1.23360313256476E+018,"Human feel bad. So setzer logged in &amp;changed her schedule. Next term she take How to Spoil Cat 101 (with lab), Inte… https://t.co/czXppR7Djs"
negative,1.23134542191575E+018,Not Available
neutral,1.23352948340521E+018,Watch: Bernie says a teacher shouldn't have to work 2 jobs then a teacher interrupts him &amp; says she works 4 jobs.… https://t.co/cxlx7uPWGA
positive,1.2237353751196E+018,Not Available
neutral,1.23671431163828E+018,"🚨attention omb fam! 🚨  tomorrow we've got @TheSierraCapri, @diegotinoco, and @TheJasonGenao for a Q&amp;A, start sendin… https://t.co/TzGXimSSSC"
neutral,1.23743877561929E+018,heyy #writingcommunity   im going through a vv tough writer's block.  any tips?   or any prompts?
neutral,1.23705760092518E+018,"In the 5 months since the beginning of the Corona Virus outbreak,  3800 people Worldwide Have died.  In that same p… https://t.co/4r0Q4OM1Pm"
positive,1.23714488943706E+018,'God is love' means that He tries constantly to block your route to destruction. #BillyGraham
positive,1.22361518284643E+018,@realDonaldTrump @LouDobbs America's Greatest President: - won BOTH the Electoral and Popular vote. TWICE. - did it… https://t.co/c9626E942c
neutral,1.23701251638503E+018,Not Available
positive,1.23271772273723E+018,"instead of giving up social media for lent, i decided to try to #BlessTheMedia by posting a saint quote every day.… https://t.co/lMPh6JcmvA"
positive,1.23309932926047E+018,It's with a broken heart I'm letting y'all know I failed. I have to close the shop. I feel like such a fuckin loser. #StonerFam I'm broken
neutral,1.22329845388061E+018,Folks on twitter know I'm scrupulously objective &amp; analytical about the Brexit views I put up. But on this occasion… https://t.co/182gsA4Jsz
positive,1.22407991318517E+018,Dubai displayed a tribute to Kobe and Gigi on the tallest building in the world 👏 https://t.co/YSLNd3to8y
negative,1.235945240286E+018,Sick... Sky News economics editor Ed Conway writes in @TheTimes that climate activists should embrace #coronavirus… https://t.co/sLhTLYfepM
negative,1.22277179585547E+018,Imagine cheating your way to a Federal election win via #sportsrorts  &amp; then making these comments in a speech seve… https://t.co/QSffhucLZH
positive,1.22352330754853E+018,"After 125 years of being South Africa’s proudly home-grown beer, this #SANBeerDay we want to give a shout out to so… https://t.co/r1gCdAATqh"
positive,1.22399285332548E+018,Not Available
neutral,1.2349950283191E+018,Not Available
negative,1.23637123822379E+018,First Lady Melania Trump is tantruming over criticism that she is spending her time building a White House tennis p… https://t.co/ai5LbxUrva
negative,1.23700041316714E+018,"Today on my ICU call, there’s a 25y old girl battling for her life while his father is admitted in HDU, both sustai… https://t.co/1Bwmh5GH1X"
neutral,1.22225312875147E+018,Not Available
neutral,1.22372999067358E+018,Not Available
neutral,1.23645324083066E+018,"SCOOP: Drug giant Gilead shipped a batch of its investigational drug, called Remdesivir, to China after requesting… https://t.co/yPbTB8kZZx"
neutral,1.23443584967836E+018,"Sadiq Khan not happy at being excluded from the coronavirus Cobra meeting. City Hall source: ""People might feel it… https://t.co/wXkRy4OfV3"
neutral,1.22101148073011E+018,"'a block of Green &amp; centre-left TDs could, if they were prepared to act together in a coherent &amp; disciplined manner… https://t.co/GxkqDVUFl4"
neutral,1.22358038627981E+018,The Senate acquitting Trump will be tantamount to Congress neutering itself. It will represent Congress giving a gr… https://t.co/fjKqa9tVjM
neutral,1.23648470564765E+018,"ORDER: #SanFrancisco bans events for 2 weeks due to #coronavirus, failure to comply will result in a misdemeanor pu… https://t.co/xIWP3IYmUA"
positive,1.23827890934877E+018,"For years, since experiencing trauma I’ve had trouble fully recovering from, I’ve only wanted to be home. I’ve felt… https://t.co/Hz0wc0a0mk"
positive,1.23582997072488E+018,Wishing British-Ghanaians and all those of Ghanaian heritage across the globe a happy Ghana Independence Day 🇬🇭… https://t.co/8VVazgkap3
neutral,1.23630303142946E+018,Hi- have you talked to a Republican or Trump supporter who has expressed doubt about the threat of Coronavirus beca… https://t.co/M3U99lSLRE
negative,1.22354795974648E+018,"Hey @BBCNews why are you incapable of reporting news of national interest? Today, the UK has 40 (that's FORTY!) new… https://t.co/MK3bQDjyL2"
negative,1.23186986520562E+018,The Coronavirus Chronicles keep getting weirder and weirder.  You've probably heard about the sudden outbreak of th… https://t.co/2COqonfeHt
positive,1.23448128422489E+018,"@eleven8 When you’re accustomed to privilege, equality feels like oppression."
